{
  "schema_version": "0.1.0",
  "dataset_id": "hcc_adult_core_gse77314",
  "benchmark_id": "hcc_cdk20",
  "accession": {
    "database": "GEO",
    "id": "GSE77314",
    "url": "https://www.ncbi.nlm.nih.gov/geo/query/acc.cgi?acc=GSE77314"
  },
  "source_publication_url": "https://pmc.ncbi.nlm.nih.gov/articles/PMC9906638/",
  "disease_context": {
    "name": "hepatocellular carcinoma",
    "ontology_ids": {
      "efo": null,
      "mesh": null,
      "doid": null
    }
  },
  "modality": "transcriptomics",
  "tissue": "liver",
  "platform": null,
  "species": "Homo sapiens",
  "role": "discovery",
  "sample_units": "bulk_sample",
  "cohorts": [
    {
      "cohort_id": "case",
      "label": "Hepatocellular carcinoma tumor tissue",
      "case_control_status": "case",
      "disease_subtype": null,
      "sample_count": 50,
      "status": "verified",
      "notes": "RNA-seq cohort with explicit paired tumor-normal counts."
    },
    {
      "cohort_id": "control",
      "label": "Paired normal liver tissue",
      "case_control_status": "control",
      "disease_subtype": null,
      "sample_count": 50,
      "status": "verified",
      "notes": null
    }
  ],
  "manifest_status": "verified",
  "provenance": {
    "primary_source_url": "https://www.ncbi.nlm.nih.gov/geo/query/acc.cgi?acc=GSE77314",
    "extraction_method": "generated_from_curated_subset_config",
    "extracted_from_section": "configs/subsets/hcc_adult_core.yaml"
  },
  "open_questions": [
    "Cross-check the generated registry record against the benchmark-pack note: GEO summary reports RNA-seq of 50 paired normal and tumor samples."
  ]
}
