{
  "schema_version": "0.1.0",
  "dataset_id": "hcc_cdk20_e_mtab_5905",
  "benchmark_id": "hcc_cdk20",
  "accession": {
    "database": "ArrayExpress",
    "id": "E-MTAB-5905",
    "url": "https://www.ebi.ac.uk/biostudies/arrayexpress/studies/E-MTAB-5905"
  },
  "source_publication_url": "https://pmc.ncbi.nlm.nih.gov/articles/PMC9906638/",
  "disease_context": {
    "name": "hepatocellular carcinoma",
    "ontology_ids": {
      "efo": null,
      "mesh": null,
      "doid": null
    }
  },
  "modality": "transcriptomics",
  "tissue": "liver",
  "platform": "Illumina HiSeq 2500",
  "species": "Homo sapiens",
  "role": "discovery",
  "sample_units": "bulk_sample",
  "cohorts": [
    {
      "cohort_id": "treatment_naive_hcc_multiregion",
      "label": "Treatment-naive hepatocellular carcinoma multiregional sampling",
      "case_control_status": "mixed",
      "disease_subtype": null,
      "sample_count": 62,
      "status": "partial",
      "notes": "BioStudies metadata exposes 62 samples total and indicates tumor and adjacent tissue were both sampled."
    }
  ],
  "manifest_status": "partial",
  "provenance": {
    "primary_source_url": "https://www.ebi.ac.uk/biostudies/arrayexpress/studies/E-MTAB-5905",
    "extraction_method": "manual_from_biostudies_record",
    "extracted_from_section": "Study metadata and sample section"
  },
  "open_questions": [
    "Recover per-arm tumor versus adjacent-tissue counts from the sample table before using this dataset in a benchmark contrast."
  ]
}
