{
  "schema_version": "0.1.0",
  "dataset_id": "als_cns_dimn_extended_gse67196_sals_cereb",
  "benchmark_id": "als_pandaomics",
  "accession": {
    "database": "GEO",
    "id": "GSE67196_sals_cereb",
    "url": "https://www.ncbi.nlm.nih.gov/geo/query/acc.cgi?acc=GSE67196_sals_cereb"
  },
  "source_publication_url": "https://pmc.ncbi.nlm.nih.gov/articles/PMC9273868/",
  "disease_context": {
    "name": "amyotrophic lateral sclerosis",
    "ontology_ids": {
      "efo": null,
      "mesh": null,
      "doid": null,
      "open_targets": "MONDO_0004976"
    }
  },
  "modality": "transcriptomics",
  "tissue": "cerebellum",
  "platform": null,
  "species": "Homo sapiens",
  "role": "discovery_cns",
  "sample_units": "bulk_sample",
  "cohorts": [
    {
      "cohort_id": "case",
      "label": "Sporadic ALS cerebellum samples",
      "case_control_status": "case",
      "disease_subtype": null,
      "sample_count": 10,
      "status": "verified",
      "notes": "Split from GSE67196 Table 1 cerebellar sporadic ALS comparison using the public rawcount matrix."
    },
    {
      "cohort_id": "control",
      "label": "Healthy cerebellum samples",
      "case_control_status": "control",
      "disease_subtype": null,
      "sample_count": 8,
      "status": "verified",
      "notes": null
    }
  ],
  "manifest_status": "verified",
  "provenance": {
    "primary_source_url": "https://www.ncbi.nlm.nih.gov/geo/query/acc.cgi?acc=GSE67196_sals_cereb",
    "extraction_method": "generated_from_curated_subset_config",
    "extracted_from_section": "configs/subsets/als_cns_dimn_extended.yaml"
  },
  "open_questions": [
    "Cross-check the generated registry record against the benchmark-pack note: Split from GSE67196 Table 1 cerebellar sporadic ALS comparison."
  ]
}
