{
  "schema_version": "0.1.0",
  "dataset_id": "hcc_adult_extended_gse45267",
  "benchmark_id": "hcc_cdk20",
  "accession": {
    "database": "GEO",
    "id": "GSE45267",
    "url": "https://www.ncbi.nlm.nih.gov/geo/query/acc.cgi?acc=GSE45267"
  },
  "source_publication_url": "https://pmc.ncbi.nlm.nih.gov/articles/PMC9906638/",
  "disease_context": {
    "name": "hepatocellular carcinoma",
    "ontology_ids": {
      "efo": "EFO_0000182",
      "mesh": null,
      "doid": null,
      "open_targets": "EFO_0000182"
    }
  },
  "modality": "transcriptomics",
  "tissue": "liver",
  "platform": null,
  "species": "Homo sapiens",
  "role": "discovery",
  "sample_units": "bulk_sample",
  "cohorts": [
    {
      "cohort_id": "case",
      "label": "Primary hepatocellular carcinoma tissue",
      "case_control_status": "case",
      "disease_subtype": null,
      "sample_count": 48,
      "status": "verified",
      "notes": "Adult HCC tissue cohort with explicit case/control counts in the accession design and a live accession-backed microarray loader."
    },
    {
      "cohort_id": "control",
      "label": "Non-cancerous liver tissue",
      "case_control_status": "control",
      "disease_subtype": null,
      "sample_count": 39,
      "status": "verified",
      "notes": null
    }
  ],
  "manifest_status": "verified",
  "provenance": {
    "primary_source_url": "https://www.ncbi.nlm.nih.gov/geo/query/acc.cgi?acc=GSE45267",
    "extraction_method": "generated_from_curated_subset_config",
    "extracted_from_section": "configs/subsets/hcc_adult_extended.yaml"
  },
  "open_questions": [
    "Cross-check the generated registry record against the benchmark-pack note: GEO overall design reports 87 tissue profiles containing 48 primary HCC samples and 39 non-cancerous tissues from 61 patients."
  ]
}
