{
  "schema_version": "0.1.0",
  "dataset_id": "ipf_lung_extended_gse150910",
  "benchmark_id": "ipf_tnik",
  "accession": {
    "database": "GEO",
    "id": "GSE150910",
    "url": "https://www.ncbi.nlm.nih.gov/geo/query/acc.cgi?acc=GSE150910"
  },
  "source_publication_url": "https://pmc.ncbi.nlm.nih.gov/articles/PMC11738990/",
  "disease_context": {
    "name": "idiopathic pulmonary fibrosis",
    "ontology_ids": {
      "efo": "EFO_0000768",
      "mesh": null,
      "doid": null,
      "open_targets": "EFO_0000768"
    }
  },
  "modality": "transcriptomics",
  "tissue": "lung",
  "platform": null,
  "species": "Homo sapiens",
  "role": "discovery",
  "sample_units": "bulk_sample",
  "cohorts": [
    {
      "cohort_id": "case",
      "label": "Idiopathic pulmonary fibrosis lung tissue",
      "case_control_status": "case",
      "disease_subtype": null,
      "sample_count": 103,
      "status": "partial",
      "notes": "Public count matrix and sample metadata expose an explicit IPF versus control split inside a broader CHP/IPF/control cohort."
    },
    {
      "cohort_id": "control",
      "label": "Unaffected control lung tissue",
      "case_control_status": "control",
      "disease_subtype": null,
      "sample_count": 103,
      "status": "partial",
      "notes": null
    }
  ],
  "manifest_status": "partial",
  "provenance": {
    "primary_source_url": "https://www.ncbi.nlm.nih.gov/geo/query/acc.cgi?acc=GSE150910",
    "extraction_method": "generated_from_curated_subset_config",
    "extracted_from_section": "configs/subsets/ipf_lung_extended.yaml"
  },
  "open_questions": [
    "Cross-check the generated registry record against the benchmark-pack note: GEO overall design reports 103 IPF and 103 unaffected-control lung samples, but the full study also includes a CHP arm and requires explicit IPF subsetting."
  ]
}
