{
  "schema_version": "0.1.0",
  "dataset_id": "hcc_adult_core_gse60502",
  "benchmark_id": "hcc_cdk20",
  "accession": {
    "database": "GEO",
    "id": "GSE60502",
    "url": "https://www.ncbi.nlm.nih.gov/geo/query/acc.cgi?acc=GSE60502"
  },
  "source_publication_url": "https://pmc.ncbi.nlm.nih.gov/articles/PMC9906638/",
  "disease_context": {
    "name": "hepatocellular carcinoma",
    "ontology_ids": {
      "efo": null,
      "mesh": null,
      "doid": null
    }
  },
  "modality": "transcriptomics",
  "tissue": "liver",
  "platform": null,
  "species": "Homo sapiens",
  "role": "discovery",
  "sample_units": "bulk_sample",
  "cohorts": [
    {
      "cohort_id": "case",
      "label": "Hepatocellular carcinoma tissue",
      "case_control_status": "case",
      "disease_subtype": null,
      "sample_count": 18,
      "status": "verified",
      "notes": "Paired adult HCC cohort with explicit accession-level counts."
    },
    {
      "cohort_id": "control",
      "label": "Adjacent non-tumorous liver tissue",
      "case_control_status": "control",
      "disease_subtype": null,
      "sample_count": 18,
      "status": "verified",
      "notes": "Adjacent or paired non-tumorous tissue is not identical to healthy tissue."
    }
  ],
  "manifest_status": "verified",
  "provenance": {
    "primary_source_url": "https://www.ncbi.nlm.nih.gov/geo/query/acc.cgi?acc=GSE60502",
    "extraction_method": "generated_from_curated_subset_config",
    "extracted_from_section": "configs/subsets/hcc_adult_core.yaml"
  },
  "open_questions": [
    "Cross-check the generated registry record against the benchmark-pack note: GEO title and sample list indicate 18 paired hepatocellular carcinoma and adjacent non-tumorous liver tissue samples."
  ]
}
