{
  "schema_version": "0.1.0",
  "dataset_id": "hcc_cdk20_gse60502",
  "benchmark_id": "hcc_cdk20",
  "accession": {
    "database": "GEO",
    "id": "GSE60502",
    "url": "https://www.ncbi.nlm.nih.gov/geo/query/acc.cgi?acc=GSE60502"
  },
  "source_publication_url": "https://pmc.ncbi.nlm.nih.gov/articles/PMC9906638/",
  "disease_context": {
    "name": "hepatocellular carcinoma",
    "ontology_ids": {
      "efo": null,
      "mesh": null,
      "doid": null
    }
  },
  "modality": "transcriptomics",
  "tissue": "liver",
  "platform": null,
  "species": "Homo sapiens",
  "role": "discovery",
  "sample_units": "bulk_sample",
  "cohorts": [
    {
      "cohort_id": "hcc",
      "label": "Hepatocellular carcinoma",
      "case_control_status": "case",
      "disease_subtype": null,
      "sample_count": 18,
      "status": "verified",
      "notes": "GEO title and sample series indicate 18 hepatocellular carcinoma tissue samples."
    },
    {
      "cohort_id": "adjacent_non_tumorous_liver",
      "label": "Adjacent non-tumorous liver tissue",
      "case_control_status": "control",
      "disease_subtype": null,
      "sample_count": 18,
      "status": "verified",
      "notes": "Paired adjacent non-tumorous liver tissue samples are described in the accession metadata."
    }
  ],
  "manifest_status": "verified",
  "provenance": {
    "primary_source_url": "https://pmc.ncbi.nlm.nih.gov/articles/PMC9906638/",
    "extraction_method": "manual_from_geo_accession_page",
    "extracted_from_section": "GEO series title and summary"
  },
  "open_questions": [
    "Confirm whether the study used all paired samples directly in the PandaOmics meta-analysis or a filtered subset."
  ]
}
